Symbol,Name,Last Sale,Net Change,% Change,Market Cap,Country,IPO Year,Volume,Sector,Industry
PTNR,Partner Communications Company Ltd. American Depositary Shares,$5.39,0.18,3.455%,984948727.00,Israel,,692,Public Utilities,Telecommunications Equipment
PTON,Peloton Interactive Inc. Class A Common Stock,$139.84,3.04,2.222%,40907734312.00,United States,2019,32487818,Energy,Consumer Electronics/Appliances
PTPI,Petros Pharmaceuticals Inc. Common Stock,$3.68,-0.12,-3.158%,35724494.00,United States,,2896625,Health Care,Major Pharmaceuticals
PTR,PetroChina Company Limited Common Stock,$31.30,0.46,1.492%,57285566051.00,China,,296576,Energy,Oil & Gas Production
PTRS,Partners Bancorp Common Stock,$6.91,0.23,3.443%,123068572.00,United States,,116784,Finance,Major Banks
PTSI,P.A.M. Transportation Services Inc. Common Stock,$43.93,-2.02,-4.396%,251917112.00,United States,1986,14675,Transportation,Trucking Freight/Courier Services
PTVCA,Protective Insurance Corporation Class A Common Stock,$15.82,0.10,0.636%,225686016.00,United States,,3088,Finance,Property-Casualty Insurers
PTVCB,Protective Insurance Corporation Class B Common Stock,$14.20,-0.48,-3.27%,202575311.00,United States,,105459,Finance,Property-Casualty Insurers
PTVE,Pactiv Evergreen Inc. Common stock,$16.75,-0.71,-4.066%,2967391643.00,United States,2020,7248828,Consumer Durables,Containers/Packaging
PTY,Pimco Corporate & Income Opportunity Fund,$17.85,0.00,0.00%,1895691688.00,United States,2002,291004,,
PUBM,PubMatic Inc. Class A Common Stock,$25.43,-2.19,-7.929%,1216227997.00,United States,2020,486373,Technology,Computer Software: Programming Data Processing
PUK,Prudential Public Limited Company Common Stock,$35.96,-0.23,-0.636%,46918615996.00,United Kingdom,,238742,Finance,Life Insurance
PUK.PR,Prudential Public Limited Company,NA,,,,,,0,,
PUK.PRA,Prudential Public Limited Company,NA,,,,,,0,,
PULM,Pulmatrix Inc. Common Stock,$1.17,-0.04,-3.306%,40256755.00,United States,2014,626270,Health Care,Major Pharmaceuticals
PUMP,ProPetro Holding Corp. Common Stock,$7.28,-0.42,-5.455%,734645017.00,United States,2017,2607791,Energy,Oilfield Services/Equipment
PUYI,Puyi Inc. American Depository Shares,$6.00,-0.03,-0.498%,361888056.00,China,2019,457,Finance,Investment Managers
PVAC,Penn Virginia Corporation Common Stock,$11.63,0.18,1.572%,176781059.00,United States,,1563491,Energy,Oil & Gas Production
PVBC,Provident Bancorp Inc. (MD) Common Stock,$11.80,-0.13,-1.09%,229216664.00,United States,2015,1058923,Finance,Savings Institutions
PVG,Pretium Resources Inc. Ordinary Shares (Canada),$11.39,-0.52,-4.366%,2132820133.00,Canada,,1430899,Basic Industries,Precious Metals
PVH,PVH Corp. Common Stock,$95.26,-1.14,-1.183%,6773009815.00,United States,,1447729,Consumer Non-Durables,Apparel
PVL,Permianville Royalty Trust Trust Units ,$0.8342,-0.0158,-1.859%,27528600.00,United States,2011,223034,Energy,Oil & Gas Production
PW,Power REIT (MD) Common Stock,$31.05,-0.725,-2.282%,59496116.00,United States,,11379,Consumer Services,Real Estate Investment Trusts
PW.PRA,Power REIT,NA,,,,,,0,,
PWFL,PowerFleet Inc. Common Stock,$7.83,0.75,10.593%,243520392.00,United States,,301936,Capital Goods,Telecommunications Equipment
PWOD,Penns Woods Bancorp Inc. Common Stock,$27.13,-0.17,-0.623%,191314873.00,United States,,39448,Finance,Major Banks
PWR,Quanta Services Inc. Common Stock,$68.29,-0.53,-0.77%,9482810861.00,United States,,2172257,Capital Goods,Engineering & Construction
PXD,Pioneer Natural Resources Company Common Stock,$114.36,-0.02,-0.017%,18802898859.00,United States,,3009660,Energy,Oil & Gas Production
PXLW,Pixelworks Inc.  Common Stock,$2.86,-0.03,-1.038%,136309004.00,United States,2000,671923,Technology,Semiconductors
PXMD,PaxMedica Inc.,NA,,,,,,0,,
PXS,Pyxis Tankers Inc. Common Stock,$0.8201,0.0101,1.247%,17681262.00,Greece,,114453,Transportation,Marine Transportation
PXSAP,Pyxis Tankers Inc. 7.75% Series A Cumulative Convertible Preferred Shares,$15.00,-0.4998,-3.225%,0.00,Greece,,686,Transportation,Marine Transportation
PXSAW,Pyxis Tankers Inc. Warrant,$0.1551,-0.095,-37.985%,0.00,Greece,,47750,Transportation,Marine Transportation
PYN,PIMCO New York Municipal Income Fund III Common Shares of Beneficial Interest,$8.71,-0.01,-0.115%,49891673.00,United States,2002,21473,,
PYPD,PolyPid Ltd. Ordinary Shares,$10.79,-0.31,-2.793%,199553972.00,Israel,2020,52162,Health Care,Medical/Dental Instruments
PYPL,PayPal Holdings Inc. Common Stock,$236.45,0.94,0.399%,277046528238.00,United States,,11525594,Miscellaneous,Business Services
PYS,Merrill Lynch Depositor Inc PPlus Tr Ser RRD-1 Tr Ctf Cl A,$18.85,-0.04,-0.212%,0.00,United States,,212,Finance,Finance: Consumer Services
PYT,PPlus Tr GSC-2 Tr Ctf Fltg Rate,$23.48,0.36,1.557%,0.00,United States,,141,Finance,Finance: Consumer Services
PZC,PIMCO California Municipal Income Fund III Common Shares of Beneficial Interest,$10.30,0.10,0.98%,230449481.00,United States,2002,34866,,
PZG,Paramount Gold Nevada Corp. Common Stock,$1.10,-0.02,-1.786%,37716458.00,United States,2015,126333,Basic Industries,Precious Metals
PZN,Pzena Investment Management Inc Class A Common Stock,$7.53,-0.44,-5.521%,535909852.00,United States,2007,146631,Finance,Investment Managers
PZZA,Papa John's International Inc. Common Stock,$90.47,1.02,1.14%,2981184086.00,United States,1993,997366,Consumer Services,Restaurants
QADA,QAD Inc. Class A Common Stock,$62.82,-1.57,-2.438%,1300316017.00,United States,,152341,Technology,Computer Software: Prepackaged Software
QADB,QAD Inc. Class B Common Stock,$46.75,0.86,1.874%,967681850.00,United States,,2721,Technology,Computer Software: Prepackaged Software
QCOM,QUALCOMM Incorporated Common Stock,$147.42,-2.11,-1.411%,166732020000.00,United States,1991,13285741,Technology,Radio And Television Broadcasting And Communications Equipment
QCRH,QCR Holdings Inc. Common Stock,$40.29,-0.67,-1.636%,636314354.00,United States,,255750,Finance,Major Banks
QD,Qudian Inc. American Depositary Shares each representing one Class A Ordinary Share,$1.27,0.02,1.60%,322236273.00,China,2017,3803325,Finance,Finance: Consumer Services
QDEL,Quidel Corporation Common Stock,$189.50,-6.93,-3.528%,7971818917.00,United States,,1021746,Health Care,Biotechnology: In Vitro & In Vivo Diagnostic Substances
QELL,Qell Acquisition Corp. Class A Ordinary Shares,$12.23,0.31,2.601%,580160625.00,United States,2020,786138,Finance,Business Services
QELLU,Qell Acquisition Corp. Unit,$12.86,0.30,2.389%,0.00,United States,2020,163981,Finance,Business Services
QELLW,Qell Acquisition Corp. Warrant,$3.10,0.32,11.511%,0.00,United States,2020,235327,Finance,Business Services
QEP,QEP Resources Inc. Common Stock,$2.31,-0.07,-2.941%,559530790.00,United States,,7386458,Energy,Oil & Gas Production
QFIN,360 DigiTech Inc. American Depositary Shares,$11.36,0.03,0.265%,1666630144.00,China,2018,730663,Finance,Finance: Consumer Services
QGEN,Qiagen N.V. Common Shares ,$52.97,1.59,3.095%,12116834530.00,Netherlands,,818059,Health Care,Biotechnology: Biological Products (No Diagnostic Substances)
QH,Quhuo Limited American Depository Shares,$7.88,0.25,3.277%,409022511.00,China,2020,91453,Miscellaneous,Business Services
QIWI,QIWI plc American Depositary Shares,$10.21,-0.15,-1.448%,640299475.00,Cyprus,2013,816845,Miscellaneous,Business Services
QK,Q&K International Group Limited American Depositary Shares,$3.42,0.00,0.00%,163705236.00,China,2019,26152,Finance,Real Estate
QLGN,Qualigen Therapeutics Inc. Common Stock,$3.33,-0.16,-4.585%,76792817.00,United States,2015,1781781,Health Care,Major Pharmaceuticals
QLYS,Qualys Inc. Common Stock,$124.54,19.59,18.666%,4859126243.00,United States,2012,2801095,Technology,Computer Software: Prepackaged Software
QMCO,Quantum Corporation Common Stock,$6.47,0.13,2.05%,263589172.00,United States,,423477,Technology,Electronic Components
QNST,QuinStreet Inc. Common Stock,$22.00,0.86,4.068%,1163652138.00,United States,2010,681630,Miscellaneous,Business Services
QQQX,Nuveen NASDAQ 100 Dynamic Overwrite Fund Shares of Beneficial Interest,$25.49,-0.11,-0.43%,1043985646.00,United States,,109705,,
QRHC,Quest Resource Holding Corporation Common Stock,$1.90,-0.02,-1.042%,34924331.00,United States,,49770,Technology,Diversified Commercial Services
QRTEA,Qurate Retail Inc. Series A Common Stock ,$10.57,-0.31,-2.849%,4410031139.00,United States,,5454806,Consumer Services,Catalog/Specialty Distribution
QRTEB,Qurate Retail Inc. Series B Common Stock ,$10.58,-0.34,-3.114%,4414203354.00,United States,,6814,Consumer Services,Catalog/Specialty Distribution
QRTEP,Qurate Retail Inc. 8.0% Fixed Rate Cumulative Redeemable Preferred Stock,$98.25,-0.13,-0.132%,0.00,United States,,78449,Consumer Services,Catalog/Specialty Distribution
QRVO,Qorvo Inc. Common Stock,$162.66,3.06,1.917%,18552040231.00,United States,,2215329,Technology,Semiconductors
QS,QuantumScape Corporation Class A Common Stock,$73.73,6.18,9.149%,26761176758.00,United States,2020,12771426,Miscellaneous,Industrial Machinery/Components
QS.WS,QuantumScape Corporation Warrants,NA,,,,United States,,0,,
QSR,Restaurant Brands International Inc. Common Shares,$61.95,-0.18,-0.29%,18777866395.00,Canada,2014,3041553,Consumer Services,Restaurants
QTNT,Quotient Limited Ordinary Shares,$7.32,0.13,1.808%,739478983.00,Switzerland,2014,6054588,Health Care,Biotechnology: In Vitro & In Vivo Diagnostic Substances
QTRX,Quanterix Corporation Common Stock,$44.00,0.20,0.457%,1393400096.00,United States,2017,870444,Capital Goods,Biotechnology: Laboratory Analytical Instruments
QTS,QTS Realty Trust Inc. Class A Common Stock,$60.33,-0.49,-0.806%,3887393956.00,United States,2013,2066677,Consumer Services,Real Estate Investment Trusts
QTS.PRA,QTS Realty Trust Inc.,NA,,,,,,0,,
QTS.PRB,QTS Realty Trust Inc.,NA,,,,,,0,,
QTT,Qutoutiao Inc. American Depositary Shares,$2.20,-0.04,-1.786%,587017314.00,China,2018,3269993,Technology,Computer Software: Programming Data Processing
QTWO,Q2 Holdings Inc. Common Stock,$123.95,0.97,0.789%,6678818798.00,,2014,773177,Technology,Computer Software: Prepackaged Software
QUAD,Quad Graphics Inc Class A Common Stock,$3.80,-0.20,-5.00%,203894738.00,United States,,561749,Miscellaneous,Publishing
QUIK,QuickLogic Corporation Common Stock,$3.38,0.23,7.302%,37411459.00,United States,1999,208194,Technology,Semiconductors
QUMU,Qumu Corporation Common Stock,$6.38,0.27,4.419%,87487951.00,United States,,221101,Technology,Computer Software: Prepackaged Software
QUOT,Quotient Technology Inc. Common Stock,$9.47,0.14,1.501%,861822634.00,,2014,1071784,Consumer Services,Advertising
QURE,uniQure N.V. Ordinary Shares,$45.95,-2.25,-4.668%,2044597679.00,Netherlands,2014,1975210,Health Care,Major Pharmaceuticals
QVCC,QVC Inc. 6.250% Senior Secured Notes due 2068,$25.50,0.00,0.00%,0.00,United States,2019,64218,Consumer Services,Catalog/Specialty Distribution
QVCD,QVC Inc. 6.375% Senior Secured Notes due 2067,$25.86,-0.04,-0.154%,0.00,United States,2018,17210,Consumer Services,Catalog/Specialty Distribution
R,Ryder System Inc. Common Stock,$63.32,0.83,1.328%,3412259268.00,United States,,1194844,Consumer Services,Rental/Leasing Companies
RA,Brookfield Real Assets Income Fund Inc. Common Stock,$17.89,-0.03,-0.167%,785197700.00,,2016,232441,,
RAACU,Revolution Acceleration Acquisition Corp Unit,$10.35,0.03,0.291%,0.00,United States,2020,4048,Finance,Business Services
RACA,Therapeutics Acquisition Corp. Class A Common Stock,$13.96,-0.05,-0.357%,243377244.00,United States,2020,8513,Finance,Business Services
RACE,Ferrari N.V. Common Shares,$225.73,2.00,0.894%,56002441913.00,,2015,179279,Capital Goods,Auto Manufacturing
RAD,Rite Aid Corporation Common Stock,$18.67,-1.41,-7.022%,1031033966.00,United States,,8917118,Health Care,Medical/Nursing Services
RADA,RADA Electronic Industries Ltd. Ordinary Shares,$9.24,0.49,5.60%,401802001.00,Israel,,994684,Technology,Electronic Components
RADI,Radius Global Infrastructure Inc. Class A Common Stock,$12.37,-0.18,-1.434%,722717250.00,United States,,4178797,Consumer Services,Real Estate
RAIL,FreightCar America Inc. Common Stock,$2.56,0.03,1.186%,39769162.00,United States,2005,421127,Capital Goods,Railroads
RAMP,LiveRamp Holdings Inc. Common Stock,$70.04,-0.17,-0.242%,4644531212.00,United States,2018,1349182,Technology,EDP Services
RAND,Rand Capital Corporation Common Stock,$12.2642,-0.2358,-1.886%,31687897.00,United States,,511,Finance,Finance: Consumer Services
RAPT,RAPT Therapeutics Inc. Common Stock,$22.65,-2.02,-8.188%,556176616.00,United States,2019,788263,Health Care,Major Pharmaceuticals
RARE,Ultragenyx Pharmaceutical Inc. Common Stock,$168.04,3.48,2.115%,11116820296.00,United States,2014,1329555,Health Care,Major Pharmaceuticals
RAVE,Rave Restaurant Group Inc. Common Stock,$0.862,-0.018,-2.045%,15520227.00,United States,,451169,Consumer Non-Durables,Food Distributors
RAVN,Raven Industries Inc. Common Stock,$33.64,-0.16,-0.473%,1206121327.00,United States,,1181398,Capital Goods,Specialty Chemicals
RBA,Ritchie Bros. Auctioneers Incorporated Common Stock,$68.14,0.79,1.173%,7475797621.00,Canada,,533880,Miscellaneous,Business Services
RBAC,RedBall Acquisition Corp. Class A Ordinary Shares,$11.00,0.04,0.365%,790625000.00,United States,2020,750853,Finance,Business Services
RBAC.U,RedBall Acquisition Corp. Units each consisting of one Class A ordinary share and one-third of one redeemable warrant,NA,,,,United States,2020,0,,
RBAC.WS,RedBall Acquisition Corp. Redeemable warrants each whole warrant exercisable for one Class A ordinary share at an exercise price of $11.50 per share,NA,,,,United States,,0,,
RBB,RBB Bancorp Common Stock,$15.42,-0.38,-2.405%,304068414.00,United States,2017,297213,Finance,Major Banks
RBBN,Ribbon Communications Inc. Common Stock,$6.32,0.01,0.158%,918906708.00,United States,,1051388,Technology,EDP Services
RBC,Regal Beloit Corporation Common Stock,$116.53,-1.15,-0.977%,4730568211.00,United States,,603578,Consumer Durables,Metal Fabrications
RBCAA,Republic Bancorp Inc. Class A Common Stock,$36.47,-1.28,-3.391%,762794558.00,United States,1998,82503,Finance,Major Banks
RBCN,Rubicon Technology Inc. Common Stock,$9.00,-0.49,-5.163%,21796398.00,United States,2007,14665,Technology,Semiconductors
RBKB,Rhinebeck Bancorp Inc. Common Stock,$8.50,-0.25,-2.857%,94632965.00,United States,2019,5368,Finance,Banks
RBNC,Reliant Bancorp Inc. Common Stock,$18.86,-0.19,-0.997%,307374169.00,United States,,117503,Finance,Major Banks
RC,Ready Capital Corproation Common Stock,$12.54,0.03,0.24%,683010926.00,United States,2013,835932,Consumer Services,Real Estate Investment Trusts
RCA,Ready Capital Corporation 7.00% Convertible Senior Notes due 2023,$24.74,-0.12,-0.483%,0.00,United States,2017,2409,Consumer Services,Real Estate Investment Trusts
RCB,Ready Capital Corporation 6.20% Senior Notes due 2026,$24.2703,-0.2097,-0.857%,0.00,United States,2019,3578,Consumer Services,Real Estate Investment Trusts
RCEL,Avita Therapeutics Inc. Common Stock,$17.70,-0.55,-3.014%,382732180.00,Australia,,651272,Health Care,Medical/Dental Instruments
RCG,RENN Fund Inc Common Stock,$1.64,0.04,2.50%,9761208.00,United States,,24095,,
RCHG,Recharge Acquisition Corp. Class A Common Stock,$9.98,0.00,0.00%,256985000.00,United States,2020,15518,Finance,Business Services
RCHGU,Recharge Acquisition Corp. Unit,$10.35,0.04,0.388%,0.00,United States,2020,60775,Finance,Business Services
RCHGW,Recharge Acquisition Corp. Warrant,$1.0284,-0.0216,-2.057%,0.00,United States,2020,98379,Finance,Business Services
RCI,Rogers Communication Inc. Common Stock,$46.67,-0.09,-0.192%,23564864591.00,Canada,,356045,Consumer Services,Television Services
RCII,Rent-A-Center Inc. Common Stock,$35.22,-0.18,-0.508%,1907883813.00,United States,1995,1491534,Technology,Diversified Commercial Services
RCKT,Rocket Pharmaceuticals Inc. Common Stock,$53.63,0.90,1.707%,3211185061.00,United States,2015,1800691,Health Care,Major Pharmaceuticals
RCKY,Rocky Brands Inc. Common Stock,$29.50,-0.23,-0.774%,213651715.00,United States,1993,82787,Consumer Non-Durables,Shoe Manufacturing
RCL,D/B/A Royal Caribbean Cruises Ltd. Common Stock,$72.29,-1.65,-2.232%,16217489371.00,United States,1993,4953773,Consumer Services,Marine Transportation
RCM,R1 RCM Inc. Common Stock,$22.75,-0.01,-0.044%,2654070101.00,United States,,1627861,Consumer Services,Other Consumer Services
RCMT,RCM Technologies Inc. Common Stock,$1.68,-0.06,-3.448%,19258940.00,United States,,64238,Technology,Professional Services
RCON,Recon Technology Ltd. Ordinary Shares,$1.25,-0.02,-1.575%,9003540.00,China,2009,162515,Energy,Oilfield Services/Equipment
RCP,Ready Capital Corporation 6.50% Senior Notes due 2021,$25.38,0.06,0.237%,0.00,United States,2018,525,Consumer Services,Real Estate Investment Trusts
RCS,PIMCO Strategic Income Fund Inc.,$6.92,-0.06,-0.86%,304037120.00,United States,1994,172708,,
RCUS,Arcus Biosciences Inc. Common Stock,$32.17,0.40,1.259%,2088582690.00,,2018,1727535,Health Care,Major Pharmaceuticals
RDCM,Radcom Ltd. Ordinary Shares,$10.58,-0.3164,-2.904%,147523880.00,Israel,1997,2022,Technology,Computer peripheral equipment
RDFI,Rareview Dynamic Fixed Income ETF,$26.7917,0.0097,0.036%,,,2020,6703,,
RDFN,Redfin Corporation Common Stock,$76.56,0.16,0.209%,7835457482.00,United States,2017,4387680,Finance,Real Estate
RDHL,Redhill Biopharma Ltd. American Depositary Shares,$8.55,-0.31,-3.499%,322291438.00,Israel,,693692,Health Care,Major Pharmaceuticals
RDI,Reading International Inc Class A Common Stock,$4.87,0.05,1.037%,105918589.00,United States,,200834,Consumer Services,Movies/Entertainment
RDIB,Reading International Inc Class B Common Stock,$21.97,1.00,4.769%,477829858.00,United States,,289,Consumer Services,Movies/Entertainment
RDN,Radian Group Inc. Common Stock,$19.92,-0.42,-2.065%,3815806835.00,United States,,2503530,Finance,Property-Casualty Insurers
RDNT,RadNet Inc. Common Stock,$17.91,-0.99,-5.238%,924802533.00,United States,,1073813,Health Care,Medical Specialities
RDS.A,Royal Dutch Shell PLC Royal Dutch Shell American Depositary Shares (Each representing two Class A Ordinary Shares),NA,,,,,,0,,
RDS/B,Royal Dutch Shell PLC,$35.85,-0.80,-2.183%,,Netherlands,,2459498,,
RDUS,Radius Health Inc. Common Stock,$19.46,0.47,2.475%,905812151.00,United States,2014,1327416,Health Care,Major Pharmaceuticals
RDVT,Red Violet Inc. Common Stock ,$27.56,0.75,2.797%,334854965.00,United States,,110044,Technology,Computer Software: Prepackaged Software
RDWR,Radware Ltd. Ordinary Shares,$26.00,0.40,1.563%,1200164628.00,Israel,1999,436157,Miscellaneous,Business Services
RDY,Dr. Reddy's Laboratories Ltd Common Stock,$70.54,1.77,2.574%,11702723059.00,India,,334916,Health Care,Major Pharmaceuticals
RE,Everest Re Group Ltd. Common Stock,$232.53,-2.63,-1.118%,9293217943.00,Bermuda,,465981,Finance,Property-Casualty Insurers
REAL,The RealReal Inc. Common Stock,$19.30,0.21,1.10%,1709543955.00,United States,2019,2712884,Consumer Services,Other Specialty Stores
REC,Emles Real Estate Credit ETF,$25.40,0.005,0.02%,,,2020,2,,
REDU,RISE Education Cayman Ltd American Depositary Shares,$6.30,0.04,0.639%,355182414.00,China,2017,67024,Consumer Services,Other Consumer Services
REED,Reeds Inc. Common Stock,$0.6005,-0.0378,-5.922%,49071401.00,United States,,698048,Consumer Non-Durables,Beverages (Production/Distribution)
REFR,Research Frontiers Incorporated Common Stock,$2.62,-0.04,-1.504%,82728559.00,United States,,360686,Miscellaneous,Multi-Sector Companies
REG,Regency Centers Corporation Common Stock,$45.93,-1.56,-3.285%,7793408463.00,United States,1993,2603832,Consumer Services,Real Estate Investment Trusts
REGI,Renewable Energy Group Inc. Common Stock,$75.58,2.31,3.153%,2972766902.00,United States,2012,4031625,Basic Industries,Major Chemicals
REGN,Regeneron Pharmaceuticals Inc. Common Stock,$498.89,2.68,0.54%,53234688047.00,United States,1991,1820849,Health Care,Major Pharmaceuticals
REI,Ring Energy Inc. Common Stock,$0.7099,-0.0219,-2.993%,57976539.00,United States,,1452540,Energy,Oil & Gas Production
REKR,Rekor Systems Inc. Common Stock,$7.43,0.36,5.092%,244998730.00,United States,,1214737,Capital Goods,Telecommunications Equipment
RELL,Richardson Electronics Ltd. Common Stock,$4.59,-0.15,-3.165%,60623132.00,United States,1983,27956,Technology,Electronic Components
RELV,Reliv' International Inc. Common Stock,$3.70,-0.01,-0.27%,6461861.00,United States,,19386,Health Care,Major Pharmaceuticals
RELX,RELX PLC PLC American Depositary Shares (Each representing One Ordinary Share),$24.43,0.07,0.287%,47201365142.00,United Kingdom,2015,490586,Consumer Services,Publishing
RENN,Renren Inc. American Depositary Shares each representing fifteen Class A ordinary shares,$6.06,0.00,0.00%,142893843.00,China,2011,113579,Consumer Durables,Automotive Aftermarket
REPH,Recro Pharma Inc. Common Stock,$3.00,-0.08,-2.597%,70933893.00,United States,2014,886664,Health Care,Major Pharmaceuticals
REPL,Replimune Group Inc. Common Stock,$39.86,-1.33,-3.229%,1832061822.00,United States,2018,3304700,Health Care,Biotechnology: Biological Products (No Diagnostic Substances)
RES,RPC Inc. Common Stock,$3.32,-0.18,-5.143%,714024342.00,United States,,2258198,Energy,Oilfield Services/Equipment
RESI,Front Yard Residential Corporation Common Stock,$16.16,-0.02,-0.124%,949353879.00,United States,,782469,Finance,Real Estate
RESN,Resonant Inc. Common Stock,$2.29,-0.04,-1.717%,124063422.00,United States,2014,2487474,Technology,Semiconductors
RETA,Reata Pharmaceuticals Inc. Class A Common Stock,$121.63,6.52,5.664%,4392758794.00,United States,2016,479515,Health Care,Major Pharmaceuticals
RETO,ReTo Eco-Solutions Inc. Common Shares,$0.675,-0.0004,-0.059%,16291125.00,China,2017,269068,Capital Goods,Industrial Machinery/Components
REV,Revlon Inc. New Common Stock,$12.09,-0.24,-1.946%,644796865.00,United States,1996,280644,Consumer Non-Durables,Package Goods/Cosmetics
REVG,REV Group Inc. Common Stock,$9.44,0.00,0.00%,599215356.00,United States,2017,484700,Capital Goods,Auto Manufacturing
REX,REX American Resources Corporation,$78.04,-5.46,-6.539%,467615836.00,United States,,143684,Basic Industries,Major Chemicals
REXR,Rexford Industrial Realty Inc. Common Stock,$47.91,-1.86,-3.737%,6253476753.00,United States,2013,3128596,Consumer Services,Real Estate Investment Trusts
REXR.PRA,Rexford Industrial Realty Inc.,NA,,,,,,0,,
REXR.PRB,Rexford Industrial Realty Inc.,NA,,,,,,0,,
REXR.PRC,Rexford Industrial Realty Inc.,NA,,,,,,0,,
REYN,Reynolds Consumer Products Inc. Common Stock,$30.43,-0.05,-0.164%,6381186215.00,United States,2020,1848310,Consumer Durables,Containers/Packaging
REZI,Resideo Technologies Inc. Common Stock ,$19.92,0.67,3.481%,2849454786.00,,2018,2805402,Capital Goods,Wholesale Distributors
RF,Regions Financial Corporation Common Stock,$15.26,-0.30,-1.928%,14656373502.00,United States,,15137984,Finance,Major Banks
RF.PRA,Regions Financial Corporation,NA,,,,,,0,,
RF.PRB,Regions Financial Corporation,NA,,,,,,0,,
RF.PRC,Regions Financial Corporation,NA,,,,,,0,,
RFI,Cohen & Steers Total Return Realty Fund Inc. Common Stock,$13.27,-0.18,-1.338%,347907711.00,United States,1993,92316,,
RFIL,RF Industries Ltd. Common Stock,$4.97,-0.72,-12.654%,48564439.00,United States,,422908,Capital Goods,Electrical Products
RFL,Rafael Holdings Inc. Class B Common Stock,$24.40,0.72,3.041%,386293724.00,United States,2018,102064,Finance,Real Estate
RFM,RiverNorth Flexible Municipal Income Fund Inc. Common Stock,$21.05,-0.25,-1.174%,0.00,,2020,13761,,
RFP,Resolute Forest Products Inc. Common Stock,$6.38,0.06,0.949%,520185204.00,Canada,,632729,Basic Industries,Paper
RGA,Reinsurance Group of America Incorporated Common Stock,$114.46,-3.33,-2.827%,7776071996.00,United States,,834164,Finance,Life Insurance
RGCO,RGC Resources Inc. Common Stock,$24.48,0.19,0.782%,200018760.00,United States,,99130,Public Utilities,Oil & Gas Production
RGEN,Repligen Corporation Common Stock,$193.90,3.49,1.833%,10609676908.00,United States,1986,822706,Health Care,Biotechnology: Biological Products (No Diagnostic Substances)
RGLD,Royal Gold Inc. Common Stock,$111.84,-3.52,-3.051%,7337221148.00,United States,,1187067,Basic Industries,Precious Metals
RGLS,Regulus Therapeutics Inc. Common Stock,$1.20,0.07,6.195%,76205644.00,United States,2012,2895108,Health Care,Major Pharmaceuticals
RGNX,REGENXBIO Inc. Common Stock,$44.93,1.32,3.027%,1680761569.00,United States,2015,1288706,Health Care,Biotechnology: Biological Products (No Diagnostic Substances)
RGP,Resources Connection Inc. Common Stock,$12.63,-0.15,-1.174%,409632642.00,United States,,983475,Miscellaneous,Business Services
RGR,Sturm Ruger & Company Inc. Common Stock,$64.27,0.52,0.816%,1124461493.00,United States,,763923,Capital Goods,Ordnance And Accessories
RGS,Regis Corporation Common Stock,$9.40,-0.30,-3.093%,335258934.00,United States,1991,875793,Consumer Services,Other Consumer Services
RGT,Royce Global Value Trust Inc. Common Stock,$13.93,-0.34,-2.383%,146313337.00,,2013,85372,,
RH,RH Common Stock,$458.29,14.65,3.302%,9349771813.00,United States,2012,637992,Consumer Services,Other Specialty Stores
RHE,Regional Health Properties Inc. Common Stock,$1.56,0.04,2.632%,2633622.00,,2017,39708,Consumer Services,Real Estate
RHE.PRA,Regional Health Properties Inc.,NA,,,,,,0,,
RHI,Robert Half International Inc. Common Stock,$63.05,0.70,1.123%,7186441207.00,United States,,1570929,Technology,Professional Services
RHP,Ryman Hospitality Properties Inc. (REIT),$61.47,-1.66,-2.629%,3379701310.00,United States,,612595,Consumer Services,Real Estate Investment Trusts
RIBT,RiceBran Technologies Common Stock,$0.551,-0.0153,-2.702%,23126899.00,United States,,598963,Consumer Non-Durables,Packaged Foods
RICE,Rice Acquisition Corp. Class A Common Stock,$10.44,0.16,1.556%,,United States,2020,9093,Finance,Business Services
