Symbol,Name,Last Sale,Net Change,% Change,Market Cap,Country,IPO Year,Volume,Sector,Industry
DAIO,Data I/O Corporation Common Stock,$4.32,-0.21,-4.636%,36358567.00,United States,1981,77254,Capital Goods,Electrical Products
DAKT,Daktronics Inc. Common Stock,$4.95,-0.28,-5.354%,222583586.00,United States,1994,1170580,Consumer Durables,Miscellaneous manufacturing industries
DAL,Delta Air Lines Inc. Common Stock,$40.68,-0.43,-1.046%,25943031365.00,United States,,14276354,Transportation,Air Freight/Delivery Services
DAN,Dana Incorporated Common Stock ,$19.51,-0.53,-2.645%,2819023546.00,United States,,2466522,Capital Goods,Auto Parts:O.E.M.
DAO,Youdao Inc. American Depositary Shares each representing one Class A Ordinary Share,$26.46,-0.21,-0.787%,2957374824.00,,2019,395987,Consumer Services,Other Consumer Services
DAR,Darling Ingredients Inc. Common Stock,$56.33,0.29,0.517%,9129317704.00,United States,,4083630,Consumer Non-Durables,Packaged Foods
DARE,Dare Bioscience Inc. Common Stock,$1.40,0.27,23.894%,53186001.00,United States,2014,7440536,Health Care,Major Pharmaceuticals
DASH,DoorDash Inc. Class A Common Stock,$166.35,12.14,7.872%,52842162268.00,,2020,8151054,Miscellaneous,Business Services
DAUG,FT Cboe Vest U.S. Equity Deep Buffer ETF - August,$33.00,0.00,0.00%,,United States,2019,11164,,
DAVA,Endava plc American Depositary Shares (each representing one Class A Ordinary Share),$75.30,1.60,2.171%,4150336079.00,,2018,111360,Technology,EDP Services
DB,Deutsche Bank AG Common Stock,$11.07,-0.06,-0.539%,22854015000.00,Germany,,2591834,Finance,Major Banks
DBD,Diebold Nixdorf Incorporated Common Stock,$11.40,-0.23,-1.978%,885534022.00,United States,,2260615,Miscellaneous,Office Equipment/Supplies/Services
DBDR,Roman DBDR Tech Acquisition Corp. Class A Common Stock,$10.06,-0.07,-0.691%,291186700.00,United States,2020,1708,Finance,Business Services
DBDRU,Roman DBDR Tech Acquisition Corp. Unit,$10.44,-0.11,-1.043%,0.00,United States,2020,484,Finance,Business Services
DBDRW,Roman DBDR Tech Acquisition Corp. Warrant,$0.97,-0.01,-1.02%,0.00,United States,2020,245325,Finance,Business Services
DBI,Designer Brands Inc. Class A Common Stock,$7.22,-0.28,-3.733%,522676572.00,United States,,2345977,Consumer Services,Clothing/Shoe/Accessory Stores
DBL,DoubleLine Opportunistic Credit Fund Common Shares of Beneficial Interest,$19.09,0.08,0.421%,285527145.00,United States,2012,50576,,
DBOC,Innovator Double Stacker 9 Buffer ETF - October,$27.06,-0.028,-0.103%,0.00,,2020,5227,,
DBVT,DBV Technologies S.A. American Depositary Shares,$3.01,0.16,5.614%,329817313.00,France,2014,765313,Health Care,Biotechnology: Biological Products (No Diagnostic Substances)
DBX,Dropbox Inc. Class A Common Stock,$23.68,-0.21,-0.879%,9794456196.00,United States,2018,7257360,Technology,Computer Software: Prepackaged Software
DCBO,Docebo Inc. Common Shares,$50.12,-0.46,-0.909%,1633671775.00,Canada,,11264,Technology,Computer Software: Prepackaged Software
DCF,BNY Mellon Alcentra Global Credit Income 2024 Target Term Fund Inc. Common Stock,$8.47,0.04,0.474%,126737728.00,,2017,56292,,
DCI,Donaldson Company Inc. Common Stock,$56.38,-0.49,-0.862%,7117406633.00,United States,,1332840,Capital Goods,Pollution Control Equipment
DCO,Ducommun Incorporated Common Stock,$52.60,0.37,0.708%,616187434.00,United States,,212598,Capital Goods,Military/Government/Technical
DCOM,Dime Community Bancshares Inc. Common Stock,$15.72,-0.64,-3.912%,519512391.00,United States,,458108,Finance,Savings Institutions
DCOMP,Dime Community Bancshares Inc. 5.50% Fixed-Rate Non-Cumulative Perpetual Preferred Stock Series A,$25.25,-0.02,-0.079%,0.00,United States,,15544,Finance,Savings Institutions
DCP,DCP Midstream  LP Common Units ,$19.14,-0.15,-0.778%,3987848246.00,United States,,1891625,Public Utilities,Natural Gas Distribution
DCP.PRB,DCP Midstream LP,NA,,,,,,0,,
DCP.PRC,DCP Midstream LP,NA,,,,,,0,,
DCPH,Deciphera Pharmaceuticals Inc. Common Stock,$54.86,-0.92,-1.649%,3123367641.00,United States,2017,948941,Health Care,Major Pharmaceuticals
DCRB,Decarbonization Plus Acquisition Corporation Class A Common Stock,$10.3499,0.0699,0.68%,293135063.00,United States,2020,176242,Finance,Business Services
DCRBU,Decarbonization Plus Acquisition Corporation Unit,$10.98,0.08,0.734%,0.00,United States,2020,49436,Finance,Business Services
DCRBW,Decarbonization Plus Acquisition Corporation Warrant,$1.55,-0.1916,-11.001%,0.00,United States,2020,107281,Finance,Business Services
DCT,Duck Creek Technologies Inc. Common Stock,$45.30,2.45,5.718%,5926737165.00,United States,2020,809477,Technology,Computer Software: Prepackaged Software
DCTH,Delcath Systems Inc. Common Stock,$17.90,1.61,9.883%,103744552.00,United States,,283843,Health Care,Medical/Dental Instruments
DCUE,Dominion Energy Inc. 2019 Series A Corporate Units,$99.56,-0.19,-0.19%,0.00,United States,2019,452939,Public Utilities,Electric Utilities: Central
DD,DuPont de Nemours Inc. Common Stock,$71.33,1.84,2.648%,52345492325.00,,2017,17437167,Basic Industries,Major Chemicals
DDD,3D Systems Corporation Common Stock,$10.86,-0.69,-5.974%,1348181414.00,United States,,7988446,Technology,Computer Software: Prepackaged Software
DDF,Delaware Investments Dividend & Income Fund Inc. Common Stock,$9.35,0.07,0.754%,71884277.00,United States,1993,26411,,
DDI,DoubleDown Interactive Co. Ltd.,NA,,,,,,0,,
DDMXU,DD3 Acquisition Corp. II Unit,$10.385,-0.065,-0.622%,0.00,Mexico,2020,16944,Finance,Business Services
DDOG,Datadog Inc. Class A Common Stock,$107.72,-0.98,-0.902%,32804224634.00,United States,2019,7519555,Technology,Computer Software: Prepackaged Software
DDS,Dillard's Inc. Common Stock,$52.25,0.25,0.481%,1149389857.00,United States,,498043,Consumer Services,Department/Specialty Retail Stores
DDT,Dillard's Capital Trust I,$25.35,0.01,0.039%,0.00,United States,,6761,Consumer Services,Department/Specialty Retail Stores
DE,Deere & Company Common Stock,$270.70,6.17,2.332%,84830549427.00,United States,,3274055,Capital Goods,Industrial Machinery/Components
DEA,Easterly Government Properties Inc. Common Stock,$21.79,-0.86,-3.797%,1770031443.00,United States,2015,1603164,Consumer Services,Real Estate Investment Trusts
DECK,Deckers Outdoor Corporation Common Stock,$294.72,-6.24,-2.073%,8276934163.00,United States,1993,512947,Consumer Non-Durables,Shoe Manufacturing
DECZ,TrueShares Structured Outcome (December) ETF,$25.17,-0.1367,-0.54%,,United States,2020,2611,,
DEFN,Emles Trust Emles Protective Allocation ETF,$24.9958,0.0081,0.032%,,,2020,217,,
DEH,D8 Holdings Corp. Class A Ordinary Shares,$10.02,0.02,0.20%,432112500.00,Hong Kong,2020,312171,Finance,Business Services
DEH.U,D8 Holdings Corp. Units each consisting of one Class A ordinary share and one-half of one redeemable warrant,NA,,,,Hong Kong,2020,0,,
DEH.WS,D8 Holdings Corp. Warrants each whole warrant exercisable for one Class A ordinary share at an exercise price of $11.50 per share,NA,,,,Hong Kong,,0,,
DEI,Douglas Emmett Inc. Common Stock,$29.60,-1.34,-4.331%,5191096626.00,United States,2006,2647237,Consumer Services,Real Estate Investment Trusts
DELL,Dell Technologies Inc. Class C Common Stock ,$72.92,-1.79,-2.396%,54675735244.00,,2018,5049018,Technology,Computer Manufacturing
DEN,Denbury Inc. Common Stock,$25.58,-1.23,-4.588%,1278999974.00,,2020,3072738,Energy,Oil & Gas Production
DENN,Denny's Corporation Common Stock,$14.15,-0.08,-0.562%,902318898.00,United States,,1331770,Consumer Services,Restaurants
DEO,Diageo plc Common Stock,$159.83,-0.14,-0.088%,93452582779.00,United Kingdom,,301910,Consumer Non-Durables,Beverages (Production/Distribution)
DESP,Despegar.com Corp. Ordinary Shares,$12.38,-0.61,-4.696%,865931480.00,,2017,544097,Consumer Services,Transportation Services
DEX,Delaware Enhanced Global Dividend Common Shares of Beneficial Interest,$9.63,-0.07,-0.722%,115630646.00,United States,2007,24196,,
DFEB,FT Cboe Vest U.S. Equity Deep Buffer ETF - February,$32.19,-0.04,-0.124%,,United States,2020,57178,,
DFFN,Diffusion Pharmaceuticals Inc. Common Stock,$0.6918,-0.0171,-2.412%,44285882.00,United States,,467674,Health Care,Major Pharmaceuticals
DFHT,Deerfield Healthcare Technology Acquisitions Corp. Class A Common Stock,$14.35,3.09,27.442%,257851563.00,United States,2020,2464039,Finance,Business Services
DFHTU,Deerfield Healthcare Technology Acquisitions Corp. Unit,$14.60,3.20,28.07%,0.00,United States,2020,582218,Finance,Business Services
DFHTW,Deerfield Healthcare Technology Acquisitions Corp. Warrant,$3.09,0.28,9.964%,0.00,United States,2020,174800,Finance,Business Services
DFHY,TrimTabs Donoghue Forlines Tactical High Yield ETF,$25.0982,-0.0013,-0.005%,,,2020,19608,,
DFIN,Donnelley Financial Solutions Inc. Common Stock ,$19.24,1.18,6.534%,642142119.00,,2016,1595269,Consumer Services,Other Consumer Services
DFNS,LGL Systems Acquisition Corp. Common Stock,$10.25,0.05,0.49%,221015625.00,United States,2020,38960,Finance,Business Services
DFNS.U,LGL Systems Acquisition Corp. Units,NA,,,,United States,2020,0,,
DFNS.WS,LGL Systems Acquisition Corp. Redeemable Warrants each whole warrant exercisable for shares of Class A Common Stock at an exercise price of $11.50 per share,NA,,,,United States,,0,,
DFNV,TrimTabs Donoghue Forlines Risk Managed Innovation ETF,$26.02,0.1543,0.597%,,,2020,16766,,
DFP,Flaherty & Crumrine Dynamic Preferred and Income Fund Inc. Common Stock,$29.50,0.23,0.786%,565566891.00,,2013,80732,,
DFPH,DFP Healthcare Acquisitions Corp. Class A Common Stock,$10.76,0.14,1.318%,309350000.00,United States,2020,709217,Finance,Business Services
DFPHU,DFP Healthcare Acquisitions Corp. Unit,$12.0439,1.0439,9.49%,0.00,United States,2020,51102,Finance,Business Services
DFPHW,DFP Healthcare Acquisitions Corp. Warrant,$1.9402,0.0802,4.312%,0.00,United States,2020,18084,Finance,Business Services
DFS,Discover Financial Services Common Stock,$85.99,-1.49,-1.703%,26355619589.00,United States,,5841069,Finance,Finance: Consumer Services
DG,Dollar General Corporation Common Stock,$210.48,-2.07,-0.974%,51567790063.00,United States,2009,4192433,Consumer Services,Department/Specialty Retail Stores
DGICA,Donegal Group Inc. Class A Common Stock,$14.30,-0.18,-1.243%,425739100.00,United States,,286491,Finance,Property-Casualty Insurers
DGICB,Donegal Group Inc. Class B Common Stock,$12.17,-0.5577,-4.382%,362324814.00,United States,1986,312,Finance,Property-Casualty Insurers
DGII,Digi International Inc. Common Stock,$18.93,-0.58,-2.973%,553551022.00,United States,1989,649239,Technology,Computer Communications Equipment
DGLY,Digital Ally Inc. Common Stock,$2.67,0.00,0.00%,71483085.00,United States,,2763191,Technology,Radio And Television Broadcasting And Communications Equipment
DGNR,Dragoneer Growth Opportunities Corp. Class A Ordinary Shares,$13.92,0.07,0.505%,1200600000.00,United States,2020,198245,Finance,Business Services
DGNR.U,Dragoneer Growth Opportunities Corp. Units each consisting of one Class A ordinary share and one-fourth of one redeemable warrant,NA,,,,United States,2020,0,,
DGNR.WS,Dragoneer Growth Opportunities Corp. Redeemable warrants each whole warrant exercisable for one Class A ordinary share at an exercise price of $11.50,NA,,,,United States,,0,,
DGNS,Dragoneer Growth Opportunities Corp. II Class A Ordinary Shares,$11.56,0.36,3.214%,365064800.00,United States,2020,203842,Finance,Business Services
DGX,Quest Diagnostics Incorporated Common Stock,$120.36,-0.36,-0.298%,16220433834.00,United States,,1879318,Health Care,Medical Specialities
DHC,Diversified Healthcare Trust Common Shares of Beneficial Interest,$4.16,-0.155,-3.592%,991196868.00,United States,,4791718,Consumer Services,Real Estate Investment Trusts
DHCNI,Diversified Healthcare Trust 5.625% Senior Notes due 2042,$23.70,-0.02,-0.084%,0.00,United States,,56145,Consumer Services,Real Estate Investment Trusts
DHCNL,Diversified Healthcare Trust 6.25% Senior Notes Due 2046,$24.33,-0.05,-0.205%,0.00,United States,,31650,Consumer Services,Real Estate Investment Trusts
DHF,BNY Mellon High Yield Strategies Fund Common Stock,$2.96,-0.02,-0.671%,215214756.00,United States,1998,1589808,,
DHI,D.R. Horton Inc. Common Stock,$73.23,-0.24,-0.327%,26684352564.00,United States,,5121514,Capital Goods,Homebuilding
DHIL,Diamond Hill Investment Group Inc. Class A Common Stock,$148.99,0.65,0.438%,471295001.00,United States,,78953,Finance,Investment Managers
DHR,Danaher Corporation Common Stock,$226.11,1.62,0.722%,160623449063.00,United States,,4221373,Capital Goods,Industrial Machinery/Components
DHR.PRA,Danaher Corporation,NA,,,,,,0,,
DHR.PRB,Danaher Corporation,NA,,,,,,0,,
DHT,DHT Holdings Inc.,$5.33,-0.06,-1.113%,910355088.00,Jersey,2005,2062014,Transportation,Marine Transportation
DHX,DHI Group Inc. Common Stock,$2.16,-0.05,-2.262%,113264581.00,United States,2007,347701,Miscellaneous,Business Services
DHY,Credit Suisse High Yield Bond Fund Common Stock,$2.285,-0.015,-0.652%,236514414.00,United States,1998,2223782,,
DIAX,Nuveen Dow 30SM Dynamic Overwrite Fund Common Shares of Beneficial Interest,$14.85,-0.11,-0.735%,540048658.00,,2014,81076,,
DIN,Dine Brands Global Inc. Common Stock,$66.67,0.08,0.12%,1094637996.00,United States,,418453,Consumer Services,Restaurants
DIOD,Diodes Incorporated Common Stock,$67.67,-0.95,-1.384%,3521679636.00,United States,,677632,Technology,Semiconductors
DIS,Walt Disney Company (The) Common Stock,$172.89,-0.66,-0.38%,313014758047.00,United States,,21166603,Consumer Services,Services-Misc. Amusement & Recreation
DISCA,Discovery Inc. Series A Common Stock,$27.80,-0.94,-3.271%,13649897773.00,United States,,8319244,Consumer Services,Television Services
DISCB,Discovery Inc. Series B Common Stock,$30.30,-2.69,-8.154%,14877406565.00,United States,,3859,Consumer Services,Television Services
DISCK,Discovery Inc. Series C Common Stock,$24.52,-0.79,-3.121%,12039406237.00,United States,,7229048,Consumer Services,Television Services
DISH,DISH Network Corporation Class A Common Stock,$30.49,-0.92,-2.929%,16037912787.00,United States,1995,7972993,Consumer Services,Television Services
DIT,AMCON Distributing Company Common Stock,$90.00,-1.87,-2.035%,49629330.00,United States,,544,Consumer Non-Durables,Food Distributors
DJCO,Daily Journal Corp. (S.C.) Common Stock,$315.20,12.35,4.078%,435211139.00,United States,,8001,Consumer Services,Newspapers/Magazines
DJUL,FT Cboe Vest U.S. Equity Deep Buffer ETF - July,$31.633,0.028,0.089%,,United States,2020,20,,
DJUN,FT Cboe Vest U.S. Equity Deep Buffer ETF - June,$32.3317,-0.0183,-0.057%,,United States,2020,4604,,
DK,Delek US Holdings Inc. Common Stock,$15.02,-0.45,-2.909%,1107360885.00,United States,2017,2772774,Energy,Integrated oil Companies
DKL,Delek Logistics Partners L.P. Common Units representing Limited Partner Interests,$29.93,-0.02,-0.067%,1299956843.00,United States,2012,84777,Energy,Natural Gas Distribution
DKNG,DraftKings Inc. Class A Common Stock,$53.90,-1.30,-2.355%,21113375221.00,United States,2019,21229058,Consumer Services,Services-Misc. Amusement & Recreation
DKS,Dick's Sporting Goods Inc Common Stock,$52.47,-0.28,-0.531%,4701242477.00,United States,2002,2381500,Consumer Services,Other Specialty Stores
DL,China Distance Education Holdings Limited American Depositary Shares,$9.57,-0.01,-0.104%,327168633.00,China,,29389,Consumer Services,Other Consumer Services
DLA,Delta Apparel Inc. Common Stock,$21.80,-0.54,-2.417%,150204572.00,United States,,11916,Consumer Non-Durables,Apparel
DLB,Dolby Laboratories Common Stock,$92.75,0.36,0.39%,9307335618.00,United States,2005,1057715,Miscellaneous,Multi-Sector Companies
DLHC,DLH Holdings Corp.,$9.01,-0.51,-5.357%,112912473.00,United States,,87809,Technology,Professional Services
DLNG,Dynagas LNG Partners LP Common Units,$2.24,-0.04,-1.754%,79772179.00,Greece,,218190,Consumer Services,Marine Transportation
DLNG.PRA,Dynagas LNG Partners LP,NA,,,,,,0,,
DLNG.PRB,Dynagas LNG Partners LP,NA,,,,,,0,,
DLPN,Dolphin Entertainment Inc. Common Stock,$3.54,-0.04,-1.117%,23223611.00,United States,,125543,Consumer Services,Other Consumer Services
DLPNW,Dolphin Entertainment Inc. Warrant,$0.0293,-0.0019,-6.09%,0.00,United States,,30132,Consumer Services,Other Consumer Services
DLR,Digital Realty Trust Inc. Common Stock,$134.02,0.09,0.067%,37547737826.00,United States,2004,5403564,Consumer Services,Real Estate Investment Trusts
DLR.PRC,Digital Realty Trust Inc.,NA,,,,,,0,,
DLR.PRJ,Digital Realty Trust Inc.,NA,,,,,,0,,
DLR.PRK,Digital Realty Trust Inc.,NA,,,,,,0,,
DLR.PRL,Digital Realty Trust Inc.,NA,,,,,,0,,
DLTH,Duluth Holdings Inc. Class B Common Stock,$11.48,-0.44,-3.691%,376867690.00,United States,2015,841104,Consumer Services,Clothing/Shoe/Accessory Stores
DLTR,Dollar Tree Inc. Common Stock,$111.88,-1.17,-1.035%,26313297966.00,United States,1995,3392376,Consumer Services,Department/Specialty Retail Stores
DLX,Deluxe Corporation Common Stock,$26.56,-0.83,-3.03%,1112704321.00,United States,,1511408,Consumer Durables,Publishing
DLY,DoubleLine Yield Opportunities Fund Common Shares of Beneficial Interest,$18.51,-0.17,-0.91%,0.00,,2020,276505,,
DM,Desktop Metal Inc. Class A Common Stock,$16.09,-0.73,-4.34%,3647683144.00,,2019,3738489,Technology,Computer peripheral equipment
DM.WS,Desktop Metal Inc. Warrants,NA,,,,,,0,,
DMAC,DiaMedica Therapeutics Inc. Common Stock,$7.32,0.12,1.667%,137170022.00,United States,2018,496164,Health Care,Major Pharmaceuticals
DMAY,FT Cboe Vest U.S. Equity Deep Buffer ETF - May,$32.6792,0.0041,0.013%,,United States,2020,650,,
DMB,BNY Mellon Municipal Bond Infrastructure Fund Inc. Common Stock,$13.93,0.00,0.00%,256138892.00,,2013,19364,,
DMF,BNY Mellon Municipal Income Inc. Common Stock,$8.71,0.05,0.577%,180739451.00,United States,1988,34696,,
DMLP,Dorchester Minerals L.P. Common Units Representing Limited Partnership Interests,$11.84,0.10,0.852%,410608524.00,United States,,55464,Energy,Oil & Gas Production
DMO,Western Asset Mortgage Opportunity Fund Inc. Common Stock,$14.41,0.17,1.194%,158280564.00,United States,2010,111660,,
DMRC,Digimarc Corporation Common Stock,$50.86,0.08,0.158%,778954620.00,United States,,209653,Technology,EDP Services
DMS,Digital Media Solutions Inc. Class A Ordinary Shares,$11.13,1.75,18.657%,649903416.00,United States,2018,326107,Miscellaneous,Business Services
DMS.WS,Digital Media Solutions Inc. Warrants ,NA,,,,United States,,0,,
DMTK,DermTech Inc. Common Stock,$15.49,1.19,8.322%,303531290.00,United States,2017,1939554,Health Care,Medical Specialities
DMYD,dMY Technology Group Inc. II Class A Common Stock,$15.30,1.02,7.143%,527850000.00,United States,2020,4307271,Finance,Business Services
DMYD.U,dMY Technology Group Inc. II Units each consisting of one share of Class A common stock and one-third of one redeemable warrant,NA,,,,United States,2020,0,,
DMYD.WS,dMY Technology Group Inc. II Redeemable Warrants,NA,,,,United States,,0,,
DMYI.U,dMY Technology Group Inc. III Units each consisting of one share of Class A common stock and one-fourth of one redeemable warrant,NA,,,,United States,2020,0,,
DMYT,dMY Technology Group Inc. Class A Common Stock,$20.60,0.28,1.378%,592250000.00,,2020,1115951,Consumer Services,Services-Misc. Amusement & Recreation
DMYT.U,dMY Technology Group Inc. Units each consisting of one share of Class A Common Stock and one-half of one redeemable Warrant,NA,,,,,2020,0,,
DMYT.WS,dMY Technology Group Inc. Redeemable Warrants each whole warrant exercisable for one share of Class A Common Stock each at an exercise price of $11.50 per share,NA,,,,,,0,,
DNB,Dun & Bradstreet Holdings Inc. Common Stock,$27.35,0.07,0.257%,11570119084.00,United States,2020,2025174,Finance,Finance: Consumer Services
DNK,Phoenix Tree Holdings Limited American Depositary Shares each representing ten (10) Class A ordinary shares,$3.04,-0.25,-7.599%,555955200.00,,2020,522139,Consumer Services,Building operators
DNLI,Denali Therapeutics Inc. Common Stock,$85.60,3.11,3.77%,10265023258.00,United States,2017,1700513,Health Care,Biotechnology: Biological Products (No Diagnostic Substances)
DNN,Denison Mines Corp Ordinary Shares (Canada),$0.5948,0.0128,2.199%,403077178.00,Canada,,2438925,Basic Industries,Precious Metals
DNOV,FT Cboe Vest U.S. Equity Deep Buffer ETF - November,$33.19,-0.10,-0.30%,,United States,2019,57551,,
DNOW,NOW Inc. Common Stock,$6.73,-0.01,-0.148%,736124890.00,,2014,2802160,Energy,Metal Fabrications
DNP,DNP Select Income Fund Inc. Common Stock,$10.37,0.01,0.097%,3149813116.00,United States,1987,562535,,
DOC,Physicians Realty Trust Common Shares of Beneficial Interest,$17.97,-0.34,-1.857%,3741888643.00,United States,2013,4087271,Consumer Services,Real Estate Investment Trusts
DOCT,FT Cboe Vest U.S. Equity Deep Buffer ETF - October,$30.8522,0.0291,0.094%,,United States,2020,6913,,
DOCU,DocuSign Inc. Common Stock,$241.00,-6.00,-2.429%,44960217238.00,United States,2018,4228437,Technology,Computer Software: Prepackaged Software
DOGZ,Dogness (International) Corporation Class A Common Stock,$1.94,0.04,2.105%,50272444.00,China,2017,24109,Consumer Durables,Miscellaneous manufacturing industries
DOMO,Domo Inc. Class B Common Stock,$66.26,-0.73,-1.09%,1984438431.00,United States,2018,3547025,Technology,Computer Software: Prepackaged Software
DOOO,BRP Inc. (Recreational Products) Common Subordinate Voting Shares,$67.52,-0.34,-0.501%,5936367178.00,Canada,,61793,Capital Goods,Industrial Specialties
DOOR,Masonite International Corporation Ordinary Shares (Canada),$100.94,1.88,1.898%,2473329489.00,Canada,,305815,Basic Industries,Forest Products
DORM,Dorman Products Inc. Common Stock,$89.39,-5.24,-5.537%,2886107845.00,United States,,851181,Capital Goods,Auto Parts:O.E.M.
DOV,Dover Corporation Common Stock,$123.86,0.10,0.081%,17848634614.00,United States,,1690445,Technology,Industrial Machinery/Components
DOW,Dow Inc. Common Stock ,$55.66,1.83,3.40%,41285903073.00,,2019,11535407,Basic Industries,Major Chemicals
DOX,Amdocs Limited Ordinary Shares,$69.24,0.92,1.347%,9078069002.00,Guernsey,,1152533,Technology,EDP Services
DOYU,DouYu International Holdings Limited ADS,$12.22,0.29,2.431%,3921966841.00,China,2019,2918912,Technology,Computer Software: Programming Data Processing
DPG,Duff & Phelps Utility and Infrastructure Fund Inc.,$11.52,-0.02,-0.173%,436951365.00,United States,2011,129331,,
DPW,DPW Holdings Inc. Common Stock,$3.81,0.10,2.695%,70438907.00,United States,,6189732,Capital Goods,Industrial Machinery/Components
DPZ,Domino's Pizza Inc Common Stock,$396.71,1.55,0.392%,15630336709.00,United States,2004,996088,Consumer Non-Durables,Food Distributors
DQ,DAQO New Energy Corp. American Depositary Shares each representing five ordinary shares,$58.26,1.12,1.96%,4048127936.00,China,2010,6007956,Technology,Semiconductors
DRAD,Digirad Corporation Common Stock,$2.86,-0.25,-8.039%,13612745.00,United States,2004,172993,Health Care,Biotechnology: Electromedical & Electrotherapeutic Apparatus
DRADP,Digirad Corporation Series A Cumulative Perpetual Preferred Stock,$8.25,0.3001,3.775%,0.00,United States,,2850,Health Care,Biotechnology: Electromedical & Electrotherapeutic Apparatus
DRD,DRDGOLD Limited American Depositary Shares,$11.92,-0.04,-0.334%,1019295638.00,South Africa,,2670345,Basic Industries,Precious Metals
DRE,Duke Realty Corporation Common Stock,$39.24,-1.21,-2.991%,14595363950.00,United States,,4152711,Consumer Services,Real Estate Investment Trusts
DRH,Diamondrock Hospitality Company Common Stock,$8.14,-0.14,-1.691%,1624083683.00,United States,2005,5037511,Consumer Services,Real Estate Investment Trusts
DRH.PRA,Diamondrock Hospitality Company,NA,,,,,,0,,
DRI,Darden Restaurants Inc. Common Stock,$116.16,-2.46,-2.074%,15124024450.00,United States,,3851233,Consumer Services,Restaurants
DRIO,DarioHealth Corp. Common Stock,$13.55,0.45,3.435%,109949578.00,Israel,,113594,Health Care,Medical/Dental Instruments
DRIOW,DarioHealth Corp. Warrant,$0.0663,0.0054,8.867%,0.00,Israel,,2100,Health Care,Medical/Dental Instruments
DRMT,Dermavant Sciences Ltd.,NA,,,,,,0,,
DRNA,Dicerna Pharmaceuticals Inc. Common Stock,$22.22,-0.57,-2.501%,1667497589.00,United States,2014,1941224,Health Care,Major Pharmaceuticals
DRQ,Dril-Quip Inc. Common Stock,$31.28,-1.09,-3.367%,1097796468.00,United States,1997,632685,Energy,Metal Fabrications
DRRX,DURECT Corporation Common Stock,$2.29,-0.14,-5.761%,465280503.00,United States,2000,2512690,Health Care,Major Pharmaceuticals
DRTT,DIRTT Environmental Solutions Ltd. Common Shares,$2.08,-0.09,-4.147%,176137237.00,Canada,,168480,Technology,Computer Software: Prepackaged Software
DRUA,Dominion Energy Inc. 2016 Series A 5.25% Enhanced Junior Subordinated Notes due 2076,$25.93,-0.05,-0.192%,0.00,United States,2016,24977,Public Utilities,Electric Utilities: Central
DS,Drive Shack Inc.,$3.25,-0.04,-1.216%,218490818.00,United States,,4903707,Consumer Services,Restaurants
DS.PRB,Drive Shack Inc.,NA,,,,,,0,,
DS.PRC,Drive Shack Inc.,NA,,,,,,0,,
DS.PRD,Drive Shack Inc.,NA,,,,,,0,,
DSAC,Duddell Street Acquisition Corp. Class A Ordinary Shares,$9.81,-0.06,-0.608%,214593750.00,Hong Kong,2020,123375,Finance,Business Services
DSACU,Duddell Street Acquisition Corp. Unit,$10.26,-0.20,-1.912%,0.00,Hong Kong,2020,27318,Finance,Business Services
DSACW,Duddell Street Acquisition Corp. Warrant,$1.21,-0.135,-10.037%,0.00,Hong Kong,2020,8035,Finance,Business Services
DSE,Duff & Phelps Select MLP and Midstream Energy Fund Inc.,$5.30,-0.01,-0.188%,13903776.00,United States,2014,11438,,
DSEP,FT Cboe Vest U.S. Equity Deep Buffer ETF - September,$30.9975,-0.0366,-0.118%,,United States,2020,1350,,
DSGX,Descartes Systems Group Inc. (The) Common Stock,$57.58,-0.82,-1.404%,4864587856.00,Canada,,130326,Technology,Computer Software: Prepackaged Software
DSKE,Daseke Inc. Common Stock,$6.02,-0.21,-3.371%,391439507.00,United States,2015,482909,Consumer Services,Transportation Services
