Symbol,Name,Last Sale,Net Change,% Change,Market Cap,Country,IPO Year,Volume,Sector,Industry
JCO,Nuveen Credit Opportunities 2022 Target Term Fund Common Shares of Beneficial Interest,$8.04,-0.01,-0.124%,223037101.00,United States,2017,75553,,
JCOM,j2 Global Inc. Common Stock,$98.41,1.78,1.842%,4404692153.00,United States,1999,1294889,Technology,Telecommunications Equipment
JCS,Communications Systems Inc. Common Stock,$4.55,-0.065,-1.408%,42408161.00,United States,,55959,Public Utilities,Telecommunications Equipment
JCTCF,Jewett-Cameron Trading Company Common Shares,$8.77,0.01,0.114%,30529791.00,United States,,2292,Consumer Services,RETAIL: Building Materials
JD,JD.com Inc. American Depositary Shares,$81.53,-1.18,-1.427%,126361471810.00,China,2014,9805056,Consumer Services,Other Specialty Stores
JDD,Nuveen Diversified Dividend and Income Fund Shares of Beneficial Interest,$8.65,-0.08,-0.916%,170720872.00,United States,2003,37572,,
JE,Just Energy Group Inc. Ordinary Shares (Canada),$4.64,0.01,0.216%,222958167.00,Canada,,923533,Public Utilities,Oil/Gas Transmission
JEF,Jefferies Financial Group Inc. Common Stock,$23.50,0.10,0.427%,5972428298.00,United States,,5173693,Finance,Investment Bankers/Brokers/Service
JELD,JELD-WEN Holding Inc. Common Stock,$24.04,0.03,0.125%,2422070844.00,United States,2017,790321,Basic Industries,Forest Products
JEMD,Nuveen Emerging Markets Debt 2022 Target Term Fund Common Shares of Beneficial Interest $0.01 par value per share,$7.53,-0.17,-2.208%,107266830.00,,2017,73744,,
JEQ,Aberdeen Japan Equity Fund Inc.  Common Stock,$9.5097,-0.0401,-0.42%,127511155.00,United States,1992,24421,,
JFIN,Jiayin Group Inc. American Depositary Shares,$3.67,0.03,0.824%,198271750.00,China,2019,74854,Finance,Finance: Consumer Services
JFR,Nuveen Floating Rate Income Fund Common Stock,$8.76,-0.01,-0.114%,498605780.00,United States,2004,133223,,
JFU,9F Inc. American Depositary Shares,$1.27,-0.03,-2.308%,247892570.00,China,2019,774119,Finance,Finance: Consumer Services
JG,Aurora Mobile Limited American Depositary Shares,$3.47,0.11,3.274%,401558904.00,China,2018,446804,Technology,Computer Software: Programming Data Processing
JGH,Nuveen Global High Income Fund Common Shares of Beneficial Interest,$15.22,-0.03,-0.197%,352759921.00,United States,2014,131151,,
JHAA,Nuveen Corporate Income 2023 Target Term Fund,$9.55,-0.04,-0.417%,74723249.00,,2018,27383,,
JHB,Nuveen Corporate Income November 2021 Target Term Fund,$9.17,0.01,0.109%,512603449.00,,2016,255835,,
JHG,Janus Henderson Group plc Ordinary Shares,$32.23,-0.41,-1.256%,5846706775.00,,2017,1943637,Finance,Investment Managers
JHI,John Hancock Investors Trust Common Stock,$17.195,-0.035,-0.203%,149717295.00,United States,,8736,,
JHS,John Hancock Income Securities Trust Common Stock,$15.66,0.08,0.513%,182385505.00,United States,,6440,,
JHX,James Hardie Industries plc American Depositary Shares (Ireland),$29.02,-0.68,-2.29%,12883049389.00,Ireland,,68152,Capital Goods,Building Materials
JIH,Juniper Industrial Holdings Inc. Class A Common Stock,$10.33,0.00,0.00%,445481250.00,,2019,105299,Finance,Business Services
JIH.U,Juniper Industrial Holdings Inc. Units each consisting of one share of Class A common stock $0.0001 par value per share and one-half of one warrant,NA,,,,,2019,0,,
JIH.WS,Juniper Industrial Holdings Inc. Redeemable warrants included as part of the units,NA,,,,,,0,,
JILL,J. Jill Inc. Common Stock,$4.23,-0.25,-5.58%,40691966.00,,2017,188669,Consumer Non-Durables,Apparel
JJSF,J & J Snack Foods Corp. Common Stock,$154.68,0.855,0.556%,2931755222.00,United States,1986,384154,Consumer Non-Durables,Specialty Foods
JKHY,Jack Henry & Associates Inc. Common Stock,$161.63,-1.13,-0.694%,12334982557.00,United States,1985,1168764,Technology,EDP Services
JKS,JinkoSolar Holding Company Limited American Depositary Shares (each representing 4 Common Shares),$65.25,5.96,10.052%,2953338910.00,China,2010,6863752,Technology,Semiconductors
JLL,Jones Lang LaSalle Incorporated Common Stock,$148.33,0.83,0.563%,7609759009.00,United States,,986594,Finance,Real Estate
JLS,Nuveen Mortgage and Income Fund,$19.55,-0.02,-0.102%,107279452.00,United States,2009,22459,,
JMIA,Jumia Technologies AG American Depositary Shares each representing two Ordinary Shares,$42.51,3.37,8.61%,3791749124.00,,2019,20113381,Consumer Services,Catalog/Specialty Distribution
JMM,Nuveen Multi-Market Income Fund (MA),$7.20,0.01,0.139%,68128920.00,United States,,11772,,
JMP,JMP Group LLC Common Shares,$3.66,0.02,0.549%,71977366.00,United States,2007,17178,Finance,Investment Bankers/Brokers/Service
JMPNL,JMP Group LLC 7.25% Senior Notes due 2027,$23.55,-0.35,-1.464%,0.00,United States,,10648,Finance,Investment Bankers/Brokers/Service
JMPNZ,JMP Group LLC 6.875% Senior Notes due 2029,$23.00,-0.28,-1.203%,0.00,United States,,7809,Finance,Investment Bankers/Brokers/Service
JNCE,Jounce Therapeutics Inc. Common Stock,$7.17,0.15,2.137%,285735076.00,United States,2017,1064461,Health Care,Biotechnology: Biological Products (No Diagnostic Substances)
JNJ,Johnson & Johnson Common Stock,$154.51,0.89,0.579%,406754168251.00,United States,,17130885,Health Care,Major Pharmaceuticals
JNPR,Juniper Networks Inc. Common Stock,$22.68,0.45,2.024%,7478420962.00,United States,1999,8450383,Technology,Computer Communications Equipment
JOB,GEE Group Inc. Common Stock,$1.02,-0.0132,-1.278%,18020465.00,United States,,74958,Technology,Diversified Commercial Services
JOBS,51job Inc. American Depositary Shares,$71.53,-0.97,-1.338%,4821160412.00,China,2004,183608,Technology,Diversified Commercial Services
JOE,St. Joe Company (The) Common Stock,$43.23,2.23,5.439%,2545492593.00,United States,,916673,Consumer Services,Homebuilding
JOF,Japan Smaller Capitalization Fund Inc Common Stock,$9.03,-0.18,-1.954%,255855054.00,United States,1990,53506,,
JOUT,Johnson Outdoors Inc. Class A Common Stock,$104.50,5.97,6.059%,1053861496.00,United States,,100931,Consumer Non-Durables,Recreational Products/Toys
JP,Jupai Holdings Limited American Depositary Shares each representing six ordinary shares,$1.774,-0.106,-5.638%,59809198.00,,2015,12133,Consumer Services,Other Consumer Services
JPC,Nuveen Preferred & Income Opportunities Fund,$9.33,-0.03,-0.321%,964303540.00,United States,2003,247995,,
JPI,Nuveen Preferred and Income Term Fund Common Shares of Beneficial Interest,$24.01,-0.22,-0.908%,546500998.00,,2012,120687,,
JPM,JP Morgan Chase & Co. Common Stock,$119.08,-0.59,-0.493%,362980020742.00,United States,,28768792,Finance,Major Banks
JPM.PRC,J P Morgan Chase & Co,NA,,,,,,0,,
JPM.PRD,J P Morgan Chase & Co,NA,,,,,,0,,
JPM.PRG,J P Morgan Chase & Co,NA,,,,,,0,,
JPM.PRH,J P Morgan Chase & Co,NA,,,,,,0,,
JPM.PRJ,J P Morgan Chase & Co,NA,,,,,,0,,
JPS,Nuveen Preferred & Income Securities Fund,$9.54,0.01,0.105%,1944059941.00,United States,2002,411813,,
JPT,Nuveen Preferred and Income 2022 Term Fund Common Shares of Beneficial Interest,$24.255,-0.2449,-1.00%,165884311.00,United States,2017,11851,,
JQC,Nuveen Credit Strategies Income Fund Shares of Beneficial Interest,$6.20,0.01,0.162%,840777598.00,United States,2003,1673035,,
JRI,Nuveen Real Asset Income and Growth Fund Common Shares of Beneficial Interest,$13.481,-0.119,-0.875%,370312016.00,United States,2012,94730,,
JRJC,China Finance Online Co. Limited American Depositary Shares,$8.94,-0.04,-0.445%,21831122.00,China,2004,10971,Finance,Investment Bankers/Brokers/Service
JRO,Nuveen Floating Rate Income Opportuntiy Fund Shares of Beneficial Interest,$8.63,-0.01,-0.116%,349870711.00,United States,2004,307113,,
JRS,Nuveen Real Estate Income Fund Common Shares of Beneficial Interest,$8.37,-0.11,-1.297%,241829982.00,United States,2001,87995,,
JRSH,Jerash Holdings (US) Inc. Common Stock,$5.32,0.00,0.00%,60249000.00,United States,2018,6451,Consumer Non-Durables,Apparel
JRVR,James River Group Holdings Ltd. Common Shares,$50.68,0.11,0.218%,1551322554.00,Bermuda,2014,476903,Finance,Property-Casualty Insurers
JSD,Nuveen Short Duration Credit Opportunities Fund Common Shares of Beneficial Interest,$13.22,0.00,0.00%,133332267.00,United States,2011,23943,,
JSM,Navient Corporation 6% Senior Notes due December 15 2043,$23.635,0.015,0.064%,0.00,United States,,14595,Finance,Finance: Consumer Services
JT,Jianpu Technology Inc. American depositary shares,$2.73,-0.02,-0.727%,57696331.00,,2017,108104,Technology,Computer Software: Programming Data Processing
JTA,Nuveen Tax-Advantaged Total Return Strategy Fund Common Share of Beneficial Interest,$9.33,-0.04,-0.427%,129228869.00,United States,2004,56932,,
JTD,Nuveen Tax-Advantaged Dividend Growth Fund Common Shares of Beneficial Interest,$13.83,-0.03,-0.216%,200318422.00,United States,,51045,,
JULZ,TrueShares Structured Outcome (July) ETF,$28.9415,-0.0521,-0.18%,,United States,2020,2494,,
JUPW,Jupiter Wellness Inc. Common Stock,$6.51,0.42,6.897%,59776988.00,United States,2020,1052592,Consumer Non-Durables,Package Goods/Cosmetics
JUPWW,Jupiter Wellness Inc. Warrant,$0.71,0.03,4.412%,0.00,United States,2020,35993,Consumer Non-Durables,Package Goods/Cosmetics
JVA,Coffee Holding Co. Inc. Common Stock,$3.95,0.04,1.023%,22548966.00,United States,2005,32865,Consumer Non-Durables,Food Distributors
JW/A,John Wiley & Sons Inc.,$44.63,-1.33,-2.894%,,United States,,1419579,,
JW/B,John Wiley & Sons Inc.,$45.62,-0.59,-1.277%,,United States,,12102,,
JWN,Nordstrom Inc. Common Stock,$30.12,-1.35,-4.29%,4749427562.00,United States,,6634497,Consumer Services,Clothing/Shoe/Accessory Stores
JWS,Jaws Acquisition Corp. Class A Ordinary Shares,$13.87,0.42,3.123%,1196287500.00,,2020,961672,Finance,Business Services
JWS.U,Jaws Acquisition Corp. Units each consisting of one Class A ordinary share and one-third of one redeemable warrant,NA,,,,,2020,0,,
JWS.WS,Jaws Acquisition Corp. Redeemable Warrants each whole warrant exercisable for one Class A ordinary share at an exercise price of $11.50,NA,,,,,,0,,
JYAC,Jiya Acquisition Corp. Class A Common Stock,$10.25,-0.05,-0.485%,140702160.00,United States,2020,31002,Finance,Business Services
JYNT,The Joint Corp. Common Stock,$26.61,0.05,0.188%,373634895.00,United States,2014,115307,Miscellaneous,Multi-Sector Companies
K,Kellogg Company Common Stock,$62.08,-0.40,-0.64%,21337701550.00,United States,,5137612,Consumer Non-Durables,Packaged Foods
KAI,Kadant Inc Common Stock,$141.49,0.05,0.035%,1628487644.00,United States,,103343,Technology,Industrial Machinery/Components
KALA,Kala Pharmaceuticals Inc. Common Stock,$7.54,-0.06,-0.789%,422691382.00,United States,2017,2040121,Health Care,Major Pharmaceuticals
KALU,Kaiser Aluminum Corporation Common Stock,$93.73,-1.30,-1.368%,1482074600.00,United States,,477990,Capital Goods,Metal Fabrications
KALV,KalVista Pharmaceuticals Inc. Common Stock,$17.70,-1.21,-6.399%,317576338.00,United Kingdom,2015,400399,Health Care,Major Pharmaceuticals
KAMN,Kaman Corporation Common Stock,$55.90,0.30,0.54%,1547166269.00,United States,,380666,Consumer Durables,Industrial Specialties
KAR,KAR Auction Services Inc Common Stock,$18.35,-0.57,-3.013%,2371765979.00,United States,2009,2459933,Consumer Durables,Automotive Aftermarket
KB,KB Financial Group Inc,$40.89,-0.99,-2.364%,16136597958.00,South Korea,,155391,Finance,Commercial Banks
KBAL,Kimball International Inc. Class B Common Stock,$12.35,0.23,1.898%,456671520.00,United States,,1037112,Consumer Durables,Home Furnishings
KBH,KB Home Common Stock,$35.54,-0.06,-0.169%,3477390331.00,United States,1986,2201575,Capital Goods,Homebuilding
KBNT,Kubient Inc. Common Stock,$7.46,0.27,3.755%,57153298.00,United States,2020,428220,Technology,EDP Services
KBNTW,Kubient Inc. Warrant,$2.33,0.08,3.556%,0.00,United States,2020,50242,Technology,EDP Services
KBR,KBR Inc. Common Stock,$29.47,0.96,3.367%,4200272252.00,United States,2006,4080850,Basic Industries,Military/Government/Technical
KBSF,KBS Fashion Group Limited Common Stock,$2.64,0.00,0.00%,6841029.00,China,2013,27371,Consumer Non-Durables,Apparel
KC,Kingsoft Cloud Holdings Limited American Depositary Shares,$47.45,-2.05,-4.141%,10344942997.00,China,2020,3870463,Technology,Computer Software: Prepackaged Software
KCAPL,KCAP Financial Inc. 6.125% Notes due 2022,$25.03,0.01,0.04%,0.00,United States,,4547,,
KDMN,Kadmon Holdings Inc. Common Stock,$4.34,-0.14,-3.125%,744366181.00,United States,,6250146,Health Care,Major Pharmaceuticals
KDNY,Chinook Therapeutics Inc. Common Stock,$19.06,-1.85,-8.847%,803539714.00,United States,2015,1688662,Health Care,Major Pharmaceuticals
KDP,Keurig Dr Pepper Inc. Common Stock,$30.93,-0.195,-0.627%,43526344383.00,United States,,11340172,Consumer Non-Durables,Beverages (Production/Distribution)
KE,Kimball Electronics Inc. Common Stock,$15.62,-0.63,-3.877%,392738174.00,United States,,236787,Technology,Electrical Products
KELYA,Kelly Services Inc. Class A Common Stock,$20.47,-0.63,-2.986%,804404677.00,United States,,513351,Technology,Professional Services
KELYB,Kelly Services Inc. Class B Common Stock,$20.38,-1.00,-4.677%,800867969.00,United States,,1375,Technology,Professional Services
KEN,Kenon Holdings Ltd. Ordinary Shares,$26.89,-0.4198,-1.537%,1448595466.00,Singapore,2015,858,Public Utilities,Electric Utilities: Central
KEP,Korea Electric Power Corporation Common Stock,$12.75,0.63,5.198%,16370083964.00,South Korea,1994,416205,Public Utilities,Electric Utilities: Central
KEQU,Kewaunee Scientific Corporation Common Stock,$10.21,-0.48,-4.49%,28208157.00,United States,,5169,Capital Goods,Medical Specialities
KERN,Akerna Corp. Common Stock,$3.75,-0.11,-2.85%,52720151.00,United States,2018,1861935,Technology,EDP Services
KERNW,Akerna Corp Warrant,$0.74,0.3399,84.954%,0.00,United States,2018,1752380,Technology,EDP Services
KEX,Kirby Corporation Common Stock,$50.11,-0.55,-1.086%,3008554290.00,United States,,1014275,Consumer Services,Marine Transportation
KEY,KeyCorp Common Stock,$15.42,-0.16,-1.027%,15057206814.00,United States,,16968957,Finance,Major Banks
KEY.PRI,KeyCorp,NA,,,,,,0,,
KEY.PRJ,KeyCorp,NA,,,,,,0,,
KEY.PRK,KeyCorp,NA,,,,,,0,,
KEYS,Keysight Technologies Inc. Common Stock,$128.26,1.40,1.104%,23766578000.00,United States,2014,2937601,Capital Goods,Industrial Machinery/Components
KF,Korea Fund Inc. (The) New Common Stock,$38.755,-0.335,-0.857%,194984892.00,United States,,2108,,
KFFB,Kentucky First Federal Bancorp Common Stock,$6.26,-0.25,-3.84%,51608786.00,United States,,2341,Finance,Savings Institutions
KFRC,Kforce Inc. Common Stock,$42.93,-0.07,-0.163%,942574429.00,United States,1995,399220,Technology,Professional Services
KFS,Kingsway Financial Services Inc. Common Stock (DE),$4.61,0.16,3.596%,104698028.00,Canada,,48357,Finance,Property-Casualty Insurers
KFY,Korn Ferry Common Stock,$42.80,1.55,3.758%,2308542634.00,United States,1999,2133342,Technology,Diversified Commercial Services
KGC,Kinross Gold Corporation Common Stock,$7.63,0.11,1.463%,9600829000.00,Canada,,98905694,Basic Industries,Precious Metals
KHC,The Kraft Heinz Company Common Stock,$34.77,0.15,0.433%,42510607551.00,United States,,11192510,Consumer Non-Durables,Packaged Foods
KIDS,OrthoPediatrics Corp. Common Stock,$44.17,0.77,1.774%,863727610.00,United States,2017,319153,Health Care,Medical/Dental Instruments
KIM,Kimco Realty Corporation Common Stock,$14.62,-0.46,-3.05%,6323130438.00,United States,,6089668,Consumer Services,Real Estate Investment Trusts
KIM.PRL,Kimco Realty Corporation,NA,,,,,,0,,
KIM.PRM,Kimco Realty Corporation,NA,,,,,,0,,
KIN,Kindred Biosciences Inc. Common Stock,$4.13,0.13,3.25%,162923598.00,United States,2013,367061,Health Care,Major Pharmaceuticals
KINS,Kingstone Companies Inc. Common Stock,$6.33,-0.01,-0.158%,67574003.00,United States,,78094,Finance,Property-Casualty Insurers
KINZU,KINS Technology Group Inc. Unit,$10.23,-0.02,-0.195%,0.00,United States,2020,185396,Finance,Business Services
KIO,KKR Income Opportunities Fund Common Shares,$14.35,0.01,0.07%,291883520.00,,2013,115222,,
KIQ,Kelso Technologies Inc Ordinary Shares,$0.5138,0.0039,0.765%,24235990.00,Canada,,74868,Capital Goods,Railroads
KIRK,Kirkland's Inc. COMMONSTOCK,$19.40,-0.33,-1.673%,276558562.00,United States,2002,1419482,Consumer Services,Other Specialty Stores
KJUL,Innovator Russell 2000 Power Buffer ETF - July,$25.82,-0.01,-0.039%,,,2020,6895,,
KKR,KKR & Co. Inc. Common Stock,$40.04,-0.38,-0.94%,22790331404.00,United States,,5724081,Finance,Investment Managers
KKR.PRA,KKR & Co. Inc.,NA,,,,,,0,,
KKR.PRB,KKR & Co. Inc.,NA,,,,,,0,,
KKR.PRC,KKR & Co. Inc.,NA,,,,,,0,,
KL,Kirkland Lake Gold Ltd. Common Shares,$41.86,-0.23,-0.546%,11427137282.00,,,1554913,Basic Industries,Precious Metals
KLAC,KLA Corporation Common Stock,$262.15,2.47,0.951%,40491641027.00,United States,1980,2220193,Capital Goods,Electronic Components
KLDO,Kaleido Biosciences Inc. Common Stock,$9.19,-0.49,-5.062%,330675545.00,United States,2019,547479,Health Care,Biotechnology: Biological Products (No Diagnostic Substances)
KLIC,Kulicke and Soffa Industries Inc. Common Stock,$32.77,-0.59,-1.769%,2032701275.00,Singapore,,782728,Technology,Semiconductors
KLR,Kaleyra Inc. Common Stock,$9.00,-0.13,-1.424%,263930229.00,United States,2018,68353,Technology,EDP Services
KLR.WS,Kaleyra Inc. Warrants,NA,,,,United States,,0,,
KLXE,KLX Energy Services Holdings Inc. Common Stock,$6.95,-0.11,-1.558%,58570089.00,United States,,103151,Energy,Oilfield Services/Equipment
KMB,Kimberly-Clark Corporation Common Stock,$135.08,-1.24,-0.91%,45945667462.00,United States,,4072659,Consumer Durables,Containers/Packaging
KMDA,Kamada Ltd. Ordinary Shares,$6.33,-0.14,-2.164%,283146306.00,Israel,2013,741607,Health Care,Major Pharmaceuticals
KMF,Kayne Anderson NextGen Energy & Infrastructure Inc.,$5.66,-0.21,-3.578%,267137635.00,,2010,214564,,
KMI,Kinder Morgan Inc. Common Stock,$14.21,-0.09,-0.629%,32164842084.00,United States,2011,33125576,Public Utilities,Natural Gas Distribution
KMPR,Kemper Corporation,$76.68,-0.66,-0.853%,5015517339.00,United States,,554862,Finance,Property-Casualty Insurers
KMT,Kennametal Inc. Common Stock,$37.16,-0.77,-2.03%,3094537349.00,United States,,1296126,Capital Goods,Industrial Machinery/Components
KMX,CarMax Inc,$98.25,-1.54,-1.543%,16121536255.00,United States,,3960002,Consumer Durables,Automotive Aftermarket
KN,Knowles Corporation Common Stock,$17.96,0.18,1.012%,1646461035.00,,2014,2605952,Consumer Non-Durables,Consumer Electronics/Appliances
KNDI,Kandi Technologies Group Inc Common Stock,$8.11,-0.08,-0.977%,586981971.00,China,,6719873,Capital Goods,Auto Manufacturing
KNL,Knoll Inc. Common Stock,$14.14,0.13,0.928%,716644229.00,United States,2004,881756,Consumer Durables,Office Equipment/Supplies/Services
KNOP,KNOT Offshore Partners LP Common Units representing Limited Partner Interests,$14.93,-0.38,-2.482%,488122823.00,United Kingdom,2013,162806,Consumer Services,Marine Transportation
KNSA,Kiniksa Pharmaceuticals Ltd. Class A Common Stock,$19.40,-0.37,-1.872%,1320655679.00,United States,2018,2391101,Health Care,Major Pharmaceuticals
KNSL,Kinsale Capital Group Inc. Common Stock,$246.46,-3.13,-1.254%,5588993876.00,United States,2016,279733,Finance,Property-Casualty Insurers
KNTE,Kinnate Biopharma Inc. Common Stock,$38.09,-1.67,-4.20%,1650333772.00,United States,2020,181895,Health Care,Major Pharmaceuticals
KNX,Knight-Swift Transportation Holdings Inc.,$42.05,0.65,1.57%,7141416131.00,United States,2017,3512068,Transportation,Trucking Freight/Courier Services
KO,Coca-Cola Company (The) Common Stock,$53.74,0.47,0.882%,230944136049.00,United States,,35472066,Consumer Non-Durables,Beverages (Production/Distribution)
KOD,Kodiak Sciences Inc Common Stock,$140.48,1.77,1.276%,7132965981.00,United States,2018,1025418,Health Care,Biotechnology: Biological Products (No Diagnostic Substances)
KODK,Eastman Kodak Company Common New,$9.59,-0.19,-1.943%,739996296.00,United States,,4084150,Miscellaneous,Industrial Machinery/Components
KOF,Coca Cola Femsa S.A.B. de C.V.  American Depositary Shares each representing 10 Units (each Unit consists of 3 Series B Shares and 5 Series L Shares),$46.24,-0.16,-0.345%,9714248370.00,Mexico,1993,146267,Consumer Non-Durables,Beverages (Production/Distribution)
KOP,Koppers Holdings Inc. Koppers Holdings Inc. Common Stock,$27.28,-1.02,-3.604%,574664576.00,United States,2006,910996,Basic Industries,Forest Products
KOPN,Kopin Corporation Common Stock,$1.91,0.17,9.77%,162451306.00,United States,1992,4891750,Technology,Semiconductors
KOR,Corvus Gold Inc. Common Shares,$2.40,-0.10,-4.00%,297570828.00,Canada,,123434,Basic Industries,Precious Metals
KOS,Kosmos Energy Ltd. Common Shares (DE),$2.23,0.13,6.19%,904164757.00,Bermuda,2011,27893960,Energy,Oil & Gas Production
KOSS,Koss Corporation Common Stock,$2.38,-0.17,-6.667%,17623498.00,United States,,7230,Consumer Non-Durables,Consumer Electronics/Appliances
KPTI,Karyopharm Therapeutics Inc. Common Stock,$16.47,1.27,8.355%,1212204797.00,United States,2013,11656609,Health Care,Major Pharmaceuticals
KR,Kroger Company (The) Common Stock,$30.87,-0.13,-0.419%,23502783742.00,United States,,13343012,Consumer Services,Food Chains
KRA,Kraton Corporation Common Stock,$26.69,-1.10,-3.958%,850660878.00,United States,2009,648565,Basic Industries,Major Chemicals
KRBP,Kiromic BioPharma Inc. Common Stock,$8.14,-0.76,-8.539%,59690612.00,United States,2020,150970,Health Care,Biotechnology: Biological Products (No Diagnostic Substances)
KRC,Kilroy Realty Corporation Common Stock,$56.53,-3.65,-6.065%,6515146718.00,United States,1997,2368894,Consumer Services,Real Estate Investment Trusts
KREF,KKR Real Estate Finance Trust Inc. Common Stock,$18.25,-0.35,-1.882%,1015054561.00,United States,2017,371732,Consumer Services,Real Estate Investment Trusts
KRG,Kite Realty Group Trust Common Stock,$14.96,-0.70,-4.47%,1259685377.00,United States,2004,1177763,Consumer Services,Real Estate Investment Trusts
KRKR,36Kr Holdings Inc. American Depositary Shares,$2.97,-0.07,-2.303%,111358190.00,China,2019,42008,Miscellaneous,Business Services
KRMD,Repro Med Systems Inc. Common Stock,$6.15,0.43,7.517%,270248761.00,United States,,657165,Health Care,Medical/Dental Instruments
KRNT,Kornit Digital Ltd. Ordinary Shares,$86.97,0.99,1.151%,3937821398.00,Israel,2015,255144,Capital Goods,Industrial Machinery/Components
KRNY,Kearny Financial Corp Common Stock,$10.46,-0.04,-0.381%,936279317.00,United States,,1215871,Finance,Savings Institutions
KRO,Kronos Worldwide Inc Common Stock,$15.26,0.07,0.461%,1763181861.00,United States,,593065,Basic Industries,Major Chemicals
KRON,Kronos Bio Inc. Common Stock,$35.21,1.75,5.23%,1972939676.00,United States,2020,2534509,Health Care,Major Pharmaceuticals
KROS,Keros Therapeutics Inc. Common Stock,$80.96,-1.78,-2.151%,1876519297.00,United States,2020,1331878,Health Care,Major Pharmaceuticals
KRP,Kimbell Royalty Partners Common Units Representing Limited Partner Interests,$8.46,-0.04,-0.471%,508295057.00,United States,2017,327137,Energy,Oil & Gas Production
KRTX,Karuna Therapeutics Inc. Common Stock,$104.36,0.38,0.365%,2797533228.00,United States,2019,478243,Health Care,Major Pharmaceuticals
KRUS,Kura Sushi USA Inc. Class A Common Stock,$17.26,-0.28,-1.596%,143988478.00,United States,2019,34944,Consumer Services,Restaurants
KRYS,Krystal Biotech Inc. Common Stock,$58.60,-2.78,-4.529%,1154866532.00,United States,2017,480385,Health Care,Biotechnology: Biological Products (No Diagnostic Substances)
KSM,DWS Strategic Municipal Income Trust,$11.29,-0.07,-0.616%,126492494.00,United States,1989,55403,,
KSMT,Kismet Acquisition One Corp Ordinary Shares,$9.89,-0.08,-0.802%,314007500.00,Russia,2020,91196,Finance,Business Services
KSMTU,Kismet Acquisition One Corp Unit,$10.06,-0.34,-3.269%,0.00,Russia,2020,32701,Finance,Business Services
KSMTW,Kismet Acquisition One Corp Warrant,$1.00,0.00,0.00%,0.00,Russia,,20101,Finance,Business Services
KSPN,Kaspien Holdings Inc. Common Stock,$14.20,-0.77,-5.144%,27053812.00,United States,,5649,Consumer Services,Consumer Electronics/Video Chains
KSS,Kohl's Corporation Common Stock,$39.40,0.44,1.129%,6211504363.00,United States,1992,6386898,Consumer Services,Department/Specialty Retail Stores
KSU,Kansas City Southern Common Stock,$197.62,1.00,0.509%,18497538113.00,United States,,1580345,Transportation,Railroads
KSU.PR,Kansas City Southern,NA,,,,,,0,,
KT,KT Corporation Common Stock,$11.34,-0.02,-0.176%,5565037527.00,South Korea,,724607,Public Utilities,Telecommunications Equipment
KTB,Kontoor Brands Inc. Common Stock ,$41.75,-0.26,-0.619%,2388324198.00,,2019,1745497,Consumer Non-Durables,Apparel
KTCC,Key Tronic Corporation Common Stock,$7.90,-0.07,-0.878%,85001472.00,United States,1983,18872,Technology,Electrical Products
KTF,DWS Municipal Income Trust,$11.39,0.00,0.00%,449915684.00,United States,1988,48642,,
KTH,Structures Products Cp 8% CorTS Issued by Peco Energy Cap Tr II Preferred Stock,$33.93,0.00,0.00%,0.00,United States,,40,Finance,Finance: Consumer Services
KTN,Structured Products Corp 8.205% CorTS 8.205% Corporate Backed Trust Securities (CorTS),$34.2881,0.00,0.00%,0.00,United States,,80,Finance,Finance: Consumer Services
KTOS,Kratos Defense & Security Solutions Inc. Common Stock,$25.76,0.67,2.67%,3162197857.00,United States,,2740595,Capital Goods,Military/Government/Technical
KTOV,Kitov Pharma Ltd. American Depositary Shares,$4.08,0.02,0.493%,70219142.00,Israel,2015,179476,Health Care,Major Pharmaceuticals
KTRA,Kintara Therapeutics Inc. Common Stock,$1.33,-0.01,-0.746%,32800858.00,United States,,488099,Health Care,Major Pharmaceuticals
KURA,Kura Oncology Inc. Common Stock,$37.13,-0.28,-0.748%,2451864290.00,United States,,2321121,Health Care,Major Pharmaceuticals
KVHI,KVH Industries Inc. Common Stock,$10.49,-0.46,-4.201%,191994893.00,United States,1996,115938,Technology,Radio And Television Broadcasting And Communications Equipment
